{
  "id": "seedance-job-local-001",
  "storyboard_id": "storyboard-local-001",
  "duration_seconds": 75,
  "aspect_ratio": "9:16",
  "mode": "scene-split-edit-pipeline",
  "global_style_anchor": "Bauhaus minimalism meets zen emptiness, matte surfaces, geometric clarity, primary color accents, generous whitespace, functional beauty",
  "continuity_locks": [
    "Bauhaus minimalism meets zen emptiness, matte surfaces, geometric clarity, primary color accents, generous whitespace, functional beauty，统一视觉风格，画面干净，避免风格漂移",
    "同一角色保持一致五官、身份、服装和发型，不变脸、不换人。",
    "同一场景保持一致环境、光线、背景与空间关系，不突然切换。",
    "主角保持同一张脸、同一发型、同一服装、同一年龄感和同一职业气质，不切换人物设定。"
  ],
  "negative_constraints": [
    "禁止风格漂移",
    "禁止角色变脸或换人",
    "禁止突然偏色",
    "禁止新增无关人物",
    "禁止光线突变",
    "禁止出现文字、字幕、LOGO、水印",
    "禁止过度装饰",
    "禁止渐变滥用",
    "禁止无意义动效"
  ],
  "slot_plan": [
    {
      "ref": "@图片1",
      "asset_id": "C01",
      "usage": "主体一致性参考"
    },
    {
      "ref": "@图片2",
      "asset_id": "S01",
      "usage": "场景或空间背景参考"
    }
  ],
  "video_type": "workflow-explainer",
  "strategy": "scene-split-edit-pipeline",
  "execution_recommendation": {
    "video_type": "workflow-explainer",
    "hard_single_generation_range_seconds": [
      4,
      15
    ],
    "official_ui_recommended_range_seconds": [
      5,
      12
    ],
    "fastest_test_window_seconds": [
      4,
      5
    ],
    "fastest_practical_window_seconds": [
      5,
      8
    ],
    "stable_expression_window_seconds": [
      8,
      12
    ],
    "default_duration_seconds_for_type": 15,
    "max_single_generation_seconds": 15,
    "scene_split_recommended_after_seconds": 60,
    "suggested_split_strategy": "split into independent scenes, then edit",
    "requested_duration_seconds": 75
  },
  "scene_plan": [
    {
      "scene_id": "scene-01",
      "start_second": 0,
      "end_second": 15,
      "edit_join": "post-edit bridge"
    },
    {
      "scene_id": "scene-02",
      "start_second": 15,
      "end_second": 30,
      "edit_join": "post-edit bridge"
    },
    {
      "scene_id": "scene-03",
      "start_second": 30,
      "end_second": 45,
      "edit_join": "post-edit bridge"
    },
    {
      "scene_id": "scene-04",
      "start_second": 45,
      "end_second": 60,
      "edit_join": "post-edit bridge"
    },
    {
      "scene_id": "scene-05",
      "start_second": 60,
      "end_second": 75,
      "edit_join": "post-edit bridge"
    }
  ],
  "prompt_blocks": [
    {
      "block_id": "pb-01",
      "scene_id": "scene-01",
      "mode": "scene-base",
      "start_second": 0,
      "end_second": 15,
      "prompt": "工作流演示视频，强调信息清晰、结果可见、过程有节奏。 风格锁定：Bauhaus minimalism meets zen emptiness, matte surfaces, geometric clarity, primary color accents, generous whitespace, functional beauty，统一视觉风格，画面干净，避免风格漂移 0-15秒画面：人物或主体清楚出现在画面中，围绕“做一个 75 秒的长流程视频，完整展示从 brief、脚本、分镜、视频任务到发布准备的全链路”逐步展开要点说明，画面持续体现 geometric simplicity、matte surfaces、generous whitespace。 镜头：稳定机位为主，先远后中，让空间关系可读。 镜头编码 Z7 Y4 X2，50mm，deep景深。 动作：主体保持稳定出现，按节奏分点说明信息，不突然切大动作。 保持同一人物发型、服装、年龄感和职业气质一致。  声音：延续统一环境音与配乐层次。 当前镜头需与前后段落保持风格连续，共 5 个镜头。 额外要求：信息层级清楚，结果面板可读，过程到结果连续",
      "image_refs": [
        "@图片1",
        "@图片2"
      ],
      "video_refs": [],
      "audio_refs": [],
      "duration_seconds": 15
    },
    {
      "block_id": "pb-02",
      "scene_id": "scene-02",
      "mode": "scene-base",
      "start_second": 15,
      "end_second": 30,
      "prompt": "工作流演示视频，强调信息清晰、结果可见、过程有节奏。 风格锁定：Bauhaus minimalism meets zen emptiness, matte surfaces, geometric clarity, primary color accents, generous whitespace, functional beauty，统一视觉风格，画面干净，避免风格漂移 15-30秒画面：人物或主体清楚出现在画面中，围绕“做一个 75 秒的长流程视频，完整展示从 brief、脚本、分镜、视频任务到发布准备的全链路”逐步展开要点说明，画面持续体现 geometric simplicity、matte surfaces、generous whitespace。 镜头：中景稳定推进，让主要流程逐步展开。 镜头编码 Z5 Y4 X2，50mm，medium景深。 动作：主体保持稳定出现，按节奏分点说明信息，不突然切大动作。 保持同一人物发型、服装、年龄感和职业气质一致。  声音：延续统一环境音与配乐层次。 当前镜头需与前后段落保持风格连续，共 5 个镜头。 额外要求：信息层级清楚，结果面板可读，过程到结果连续",
      "image_refs": [
        "@图片1",
        "@图片2"
      ],
      "video_refs": [],
      "audio_refs": [],
      "duration_seconds": 15
    },
    {
      "block_id": "pb-03",
      "scene_id": "scene-03",
      "mode": "scene-base",
      "start_second": 30,
      "end_second": 45,
      "prompt": "工作流演示视频，强调信息清晰、结果可见、过程有节奏。 风格锁定：Bauhaus minimalism meets zen emptiness, matte surfaces, geometric clarity, primary color accents, generous whitespace, functional beauty，统一视觉风格，画面干净，避免风格漂移 30-45秒画面：人物或主体清楚出现在画面中，围绕“做一个 75 秒的长流程视频，完整展示从 brief、脚本、分镜、视频任务到发布准备的全链路”逐步展开要点说明，画面持续体现 geometric simplicity、matte surfaces、generous whitespace。 镜头：由中景推进到近景，局部横移辅助变化。 镜头编码 Z5 Y4 X2，50mm，medium景深。 动作：主体保持稳定出现，按节奏分点说明信息，不突然切大动作。 保持同一人物发型、服装、年龄感和职业气质一致。  声音：延续统一环境音与配乐层次。 当前镜头需与前后段落保持风格连续，共 5 个镜头。 额外要求：信息层级清楚，结果面板可读，过程到结果连续",
      "image_refs": [
        "@图片1",
        "@图片2"
      ],
      "video_refs": [],
      "audio_refs": [],
      "duration_seconds": 15
    },
    {
      "block_id": "pb-04",
      "scene_id": "scene-04",
      "mode": "scene-base",
      "start_second": 45,
      "end_second": 60,
      "prompt": "工作流演示视频，强调信息清晰、结果可见、过程有节奏。 风格锁定：Bauhaus minimalism meets zen emptiness, matte surfaces, geometric clarity, primary color accents, generous whitespace, functional beauty，统一视觉风格，画面干净，避免风格漂移 45-60秒画面：人物或主体清楚出现在画面中，围绕“做一个 75 秒的长流程视频，完整展示从 brief、脚本、分镜、视频任务到发布准备的全链路”逐步展开要点说明，画面持续体现 geometric simplicity、matte surfaces、generous whitespace。 镜头：近景强化高潮主体，镜头更聚焦更有冲击。 镜头编码 Z3 Y4 X2，85mm，shallow景深。 动作：主体保持稳定出现，按节奏分点说明信息，不突然切大动作。 保持同一人物发型、服装、年龄感和职业气质一致。  声音：延续统一环境音与配乐层次。 当前镜头需与前后段落保持风格连续，共 5 个镜头。 额外要求：信息层级清楚，结果面板可读，过程到结果连续",
      "image_refs": [
        "@图片1",
        "@图片2"
      ],
      "video_refs": [],
      "audio_refs": [],
      "duration_seconds": 15
    },
    {
      "block_id": "pb-05",
      "scene_id": "scene-05",
      "mode": "scene-base",
      "start_second": 60,
      "end_second": 75,
      "prompt": "工作流演示视频，强调信息清晰、结果可见、过程有节奏。 风格锁定：Bauhaus minimalism meets zen emptiness, matte surfaces, geometric clarity, primary color accents, generous whitespace, functional beauty，统一视觉风格，画面干净，避免风格漂移 60-75秒画面：人物或主体清楚出现在画面中，围绕“做一个 75 秒的长流程视频，完整展示从 brief、脚本、分镜、视频任务到发布准备的全链路”逐步展开要点说明，画面持续体现 geometric simplicity、matte surfaces、generous whitespace。 镜头：从近景回到中远景，轻微拉远完成收束。 镜头编码 Z6 Y4 X4，50mm，medium景深。 动作：主体保持稳定出现，按节奏分点说明信息，不突然切大动作。 保持同一人物发型、服装、年龄感和职业气质一致。  声音：延续统一环境音与配乐层次。 当前镜头需与前后段落保持风格连续，共 5 个镜头。 额外要求：信息层级清楚，结果面板可读，过程到结果连续",
      "image_refs": [
        "@图片1",
        "@图片2"
      ],
      "video_refs": [],
      "audio_refs": [],
      "duration_seconds": 15
    }
  ],
  "identity_strategy": "derived-stills"
}
