{
  "id": "seedance-job-local-001",
  "storyboard_id": "storyboard-local-001",
  "duration_seconds": 15,
  "aspect_ratio": "9:16",
  "mode": "text-image-video",
  "global_style_anchor": "clean tech cinematic，统一视觉风格，画面干净，避免风格漂移",
  "continuity_locks": [
    "clean tech cinematic，统一视觉风格，画面干净，避免风格漂移",
    "同一角色保持一致五官、身份、服装和发型，不变脸、不换人。",
    "同一场景保持一致环境、光线、背景与空间关系，不突然切换。"
  ],
  "negative_constraints": [
    "禁止风格漂移",
    "禁止角色变脸或换人",
    "禁止突然偏色",
    "禁止新增无关人物",
    "禁止光线突变",
    "禁止出现文字、字幕、LOGO、水印"
  ],
  "slot_plan": [
    {
      "ref": "@图片1",
      "asset_id": "C01",
      "usage": "主体一致性参考"
    },
    {
      "ref": "@图片2",
      "asset_id": "S01",
      "usage": "场景或空间背景参考"
    },
    {
      "ref": "@图片3",
      "asset_id": "P01",
      "usage": "关键道具、结果卡片或动作强化参考"
    }
  ],
  "video_type": "workflow-explainer",
  "strategy": "five-beat-short-video",
  "execution_recommendation": {
    "video_type": "workflow-explainer",
    "hard_single_generation_range_seconds": [
      4,
      15
    ],
    "official_ui_recommended_range_seconds": [
      5,
      12
    ],
    "fastest_test_window_seconds": [
      4,
      5
    ],
    "fastest_practical_window_seconds": [
      5,
      8
    ],
    "stable_expression_window_seconds": [
      8,
      12
    ],
    "default_duration_seconds_for_type": 15,
    "max_single_generation_seconds": 15,
    "scene_split_recommended_after_seconds": 60,
    "suggested_split_strategy": "single-generation",
    "requested_duration_seconds": 15
  },
  "scene_plan": [],
  "prompt_blocks": [
    {
      "block_id": "pb-01",
      "scene_id": "scene-01",
      "mode": "single-sequence",
      "start_second": 0,
      "end_second": 3,
      "prompt": "工作流演示视频，强调信息清晰、结果可见、过程有节奏。 风格锁定：clean tech cinematic，统一视觉风格，画面干净，避免风格漂移 0-3秒画面：竖屏开场直接给结果感，画面突出AI assistant、script generation、video publish workflow，第一秒就让观众明白这是自动生成与发布的能力展示。 镜头：快速推近，第一眼抓人，镜头编码 Z4 Y4 X1，35mm，shallow景深。 动作：主体抬手唤起自动化流程，界面快速响应。 声音：短促电子提示音，开场即抓注意力。 额外要求：信息层级清楚，结果面板可读，过程到结果连续",
      "image_refs": [
        "@图片1",
        "@图片2",
        "@图片3"
      ],
      "video_refs": [],
      "audio_refs": []
    },
    {
      "block_id": "pb-02",
      "scene_id": "scene-02",
      "mode": "single-sequence",
      "start_second": 3,
      "end_second": 6,
      "prompt": "工作流演示视频，强调信息清晰、结果可见、过程有节奏。 风格锁定：clean tech cinematic，统一视觉风格，画面干净，避免风格漂移 3-6秒画面：切到工作台与产品界面，brief、脚本和分镜结构被展开，空间关系清楚，信息密度可读。 镜头：中景稳定推进，交代空间和工作流背景，镜头编码 Z5 Y4 X2，50mm，medium景深。 动作：工作流面板展开，信息按顺序进入视野。 声音：轻量环境音和键盘操作音，强调真实工作台氛围。 额外要求：信息层级清楚，结果面板可读，过程到结果连续",
      "image_refs": [
        "@图片1",
        "@图片2",
        "@图片3"
      ],
      "video_refs": [],
      "audio_refs": []
    },
    {
      "block_id": "pb-03",
      "scene_id": "scene-03",
      "mode": "single-sequence",
      "start_second": 6,
      "end_second": 9,
      "prompt": "工作流演示视频，强调信息清晰、结果可见、过程有节奏。 风格锁定：clean tech cinematic，统一视觉风格，画面干净，避免风格漂移 6-9秒画面：主体进入执行段，系统开始生成素材编号、分镜镜头和任务清单，视觉信息逐步加速。 镜头：轻微横移配合主体操作，展示变化推进，镜头编码 Z5 Y4 X2，50mm，medium景深。 动作：系统编译脚本、镜头、素材和任务对象。 声音：节奏加快的界面反馈音和轻微上扬配乐。 额外要求：信息层级清楚，结果面板可读，过程到结果连续",
      "image_refs": [
        "@图片1",
        "@图片2",
        "@图片3"
      ],
      "video_refs": [],
      "audio_refs": []
    },
    {
      "block_id": "pb-04",
      "scene_id": "scene-04",
      "mode": "single-sequence",
      "start_second": 9,
      "end_second": 12,
      "prompt": "工作流演示视频，强调信息清晰、结果可见、过程有节奏。 风格锁定：clean tech cinematic，统一视觉风格，画面干净，避免风格漂移 9-12秒画面：结果面板集中展示 script、storyboard、seedance job 和 publish job，被编译完成的核心成果清晰可见。 镜头：由中景推到近景，强调结果与完成状态，镜头编码 Z3 Y4 X2，85mm，shallow景深。 动作：结果面板依次亮起，任务状态从草稿变为已准备。 声音：结果确认音，配乐进入最高点后短暂停留。 额外要求：信息层级清楚，结果面板可读，过程到结果连续",
      "image_refs": [
        "@图片1",
        "@图片2",
        "@图片3"
      ],
      "video_refs": [],
      "audio_refs": []
    },
    {
      "block_id": "pb-05",
      "scene_id": "scene-05",
      "mode": "single-sequence",
      "start_second": 12,
      "end_second": 15,
      "prompt": "工作流演示视频，强调信息清晰、结果可见、过程有节奏。 风格锁定：clean tech cinematic，统一视觉风格，画面干净，避免风格漂移 12-15秒画面：画面停在待发布状态，主体确认方案，给出能继续执行的明确收束。 镜头：缓慢拉远，形成收束和留白，镜头编码 Z6 Y4 X4，50mm，medium景深。 动作：主体停留在确认前一刻，形成发布前停顿。 声音：收束音效，留下可执行的呼吸感。 额外要求：信息层级清楚，结果面板可读，过程到结果连续",
      "image_refs": [
        "@图片1",
        "@图片2",
        "@图片3"
      ],
      "video_refs": [],
      "audio_refs": []
    }
  ]
}
