{
  "id": "seedance-job-local-001",
  "storyboard_id": "storyboard-local-001",
  "duration_seconds": 4,
  "aspect_ratio": "9:16",
  "mode": "text-image-video",
  "global_style_anchor": "clean tech premium，统一视觉风格，画面干净，避免风格漂移",
  "continuity_locks": [
    "clean tech premium，统一视觉风格，画面干净，避免风格漂移",
    "同一角色保持一致五官、身份、服装和发型，不变脸、不换人。",
    "同一场景保持一致环境、光线、背景与空间关系，不突然切换。"
  ],
  "negative_constraints": [
    "禁止风格漂移",
    "禁止角色变脸或换人",
    "禁止突然偏色",
    "禁止新增无关人物",
    "禁止光线突变",
    "禁止出现文字、字幕、LOGO、水印"
  ],
  "slot_plan": [
    {
      "ref": "@图片1",
      "asset_id": "C01",
      "usage": "主体一致性参考"
    },
    {
      "ref": "@图片2",
      "asset_id": "S01",
      "usage": "场景或空间背景参考"
    },
    {
      "ref": "@图片3",
      "asset_id": "P01",
      "usage": "关键道具、结果卡片或动作强化参考"
    }
  ],
  "video_type": "product-demo",
  "strategy": "five-beat-short-video",
  "execution_recommendation": {
    "video_type": "product-demo",
    "hard_single_generation_range_seconds": [
      4,
      15
    ],
    "official_ui_recommended_range_seconds": [
      5,
      12
    ],
    "fastest_test_window_seconds": [
      4,
      5
    ],
    "fastest_practical_window_seconds": [
      5,
      8
    ],
    "stable_expression_window_seconds": [
      6,
      10
    ],
    "default_duration_seconds_for_type": 8,
    "max_single_generation_seconds": 15,
    "scene_split_recommended_after_seconds": 60,
    "suggested_split_strategy": "single-generation",
    "requested_duration_seconds": 4
  },
  "scene_plan": [],
  "prompt_blocks": [
    {
      "block_id": "pb-01",
      "scene_id": "scene-01",
      "mode": "single-sequence",
      "start_second": 0,
      "end_second": 1,
      "prompt": "商业产品演示视频，强调卖点直给、UI 清晰、动作利落。 风格锁定：clean tech premium，统一视觉风格，画面干净，避免风格漂移 0-1秒画面：开场直接打产品或应用结果镜头，画面突出finished result、clean UI，先给强展示感。 镜头：快速推近，第一眼抓人，镜头编码 Z4 Y4 X1，35mm，shallow景深。 动作：产品界面或结果卡片直接打在第一镜头，避免铺垫过长。 声音：短促电子提示音，开场即抓注意力。 额外要求：商业广告节奏，卖点一眼可见，界面与动效高级干净",
      "image_refs": [
        "@图片1",
        "@图片2",
        "@图片3"
      ],
      "video_refs": [],
      "audio_refs": []
    },
    {
      "block_id": "pb-02",
      "scene_id": "scene-02",
      "mode": "single-sequence",
      "start_second": 1,
      "end_second": 2,
      "prompt": "商业产品演示视频，强调卖点直给、UI 清晰、动作利落。 风格锁定：clean tech premium，统一视觉风格，画面干净，避免风格漂移 1-2秒画面：切到产品 UI 主界面和关键结果卡片，信息层级清楚，重点模块一眼可识别。 镜头：中景稳定推进，交代空间和工作流背景，镜头编码 Z5 Y4 X2，50mm，medium景深。 动作：关键功能模块逐层点亮，主流程入口被清晰揭示。 声音：轻量环境音和键盘操作音，强调真实工作台氛围。 额外要求：商业广告节奏，卖点一眼可见，界面与动效高级干净",
      "image_refs": [
        "@图片1",
        "@图片2",
        "@图片3"
      ],
      "video_refs": [],
      "audio_refs": []
    },
    {
      "block_id": "pb-03",
      "scene_id": "scene-03",
      "mode": "single-sequence",
      "start_second": 2,
      "end_second": 3,
      "prompt": "商业产品演示视频，强调卖点直给、UI 清晰、动作利落。 风格锁定：clean tech premium，统一视觉风格，画面干净，避免风格漂移 2-3秒画面：产品或应用核心卖点被清楚展示，结果面板与价值一眼可见。 镜头：由中景推到近景，强调结果与完成状态，镜头编码 Z3 Y4 X2，85mm，shallow景深。 动作：卖点完成闭环展示，核心结果被定格强调。 声音：结果确认音，配乐进入最高点后短暂停留。 额外要求：商业广告节奏，卖点一眼可见，界面与动效高级干净",
      "image_refs": [
        "@图片1",
        "@图片2",
        "@图片3"
      ],
      "video_refs": [],
      "audio_refs": []
    },
    {
      "block_id": "pb-04",
      "scene_id": "scene-04",
      "mode": "single-sequence",
      "start_second": 3,
      "end_second": 4,
      "prompt": "商业产品演示视频，强调卖点直给、UI 清晰、动作利落。 风格锁定：clean tech premium，统一视觉风格，画面干净，避免风格漂移 3-4秒画面：品牌名、产品名或最终完成状态被定格，形成短促有力的记忆点。 镜头：缓慢拉远，形成收束和留白，镜头编码 Z6 Y4 X4，50mm，medium景深。 动作：品牌或产品名停留在最后一刻形成记忆点。 声音：收束音效，留下可执行的呼吸感。 额外要求：商业广告节奏，卖点一眼可见，界面与动效高级干净",
      "image_refs": [
        "@图片1",
        "@图片2",
        "@图片3"
      ],
      "video_refs": [],
      "audio_refs": []
    }
  ]
}
